name,website,address,phone,category,rating,reviews_count
Shéa Medical Aesthetics Clinic,https://sheamedicalaesthetics.co.uk/,"260 Fulham Rd., London SW10 9EL, Spojené kráľovstvo",+447920647343,"Liečebné kúpele, Obchod s produktmi pre zdravie a krásu",5,
The Lovely Clinic,http://thelovelyclinic.co.uk/,"8 Beauchamp Pl, London SW3 1NQ, Spojené kráľovstvo",+442036955400,"Liečebné kúpele, Klinika starostlivosti o pleť",4.9,
Clinic Dr Dray,http://www.drdray.co.uk/,"20 Canning Pl, South Kensington, London W8 5AD, Spojené kráľovstvo",+442079371031,"Klinika starostlivosti o pleť, Liečebné kúpele",4.8,
Mallucci South Kensington,https://www.mallucci-london.com/?utm_source=Google&utm_medium=Organic&utm_campaign=Google+Business+Profile,"13 Crescent Pl, London SW3 2EA, Spojené kráľovstvo",+442039157400,"Liečebné kúpele, Kozmetický salón, Klinika plastickej chirurgie, Klinika starostlivosti o pleť",4.8,
Natali Kelly Clinic,http://natalikelly.com/,"69 Walton St, London SW3 2HT, Spojené kráľovstvo",+442075819911,"Klinika starostlivosti o pleť, Dermatológ, Obchod s produktmi pre zdravie a krásu, Liečebné kúpele",4.9,
Kensington Skin Clinic,http://www.kensingtonskinclinic.co.uk/,"54 Knightsbridge, London SW1X 7JN, United Kingdom",+447570153825,Skin care clinic,4.9,
Eden Skin Clinic - Kensington,https://www.edenskinclinic.co.uk/?utm_source=GMB%20kensington&utm_medium=organic,"21 Gloucester Rd, South Kensington, London SW7 4PL, United Kingdom",+442075840115,"Skin care clinic, Beauty salon, Electrolysis hair removal service, Facial spa, Laser hair removal service, Massage therapist, Waxing hair removal service",4.9,
Facial Sculpting,http://www.facialsculpting.co.uk/,"313 Brompton Rd, South Kensington, London SW3 2DY, United Kingdom",+442039519886,"Skin care clinic, Cosmetic dentist, Medical clinic",4.9,
Skin Reset Cosmetology Clinic,http://www.skin-reset.com/,"The Courtyard by Paollo Sagerah, 151 Sydney St, London SW3 6NT, United Kingdom",+447877850549,"Skin care clinic, Facial spa",5,
D.Thomas Clinic,http://www.dthomas.com/,"c/o, The D Thomas Clinic, 25 Walton St, London SW3 2HU, United Kingdom",+442071189000,"Skin care clinic, Beauty salon, Facial spa, Laser hair removal service",4.9,
ID Aesthetics Skin clinic,https://www.idaesthetics.co.uk/,"35 Bulls Gardens, London SW3 2JX, United Kingdom",+447426033313,Skin care clinic,5,
Ceylon Aesthetics & Beauty Ltd,https://ceylonaesthetic.co.uk/,"127 Fulham Rd., London SW3 6RT, United Kingdom",+442033420785,Laser hair removal service,4.9,
Taura's Aesthetic Clinic,https://www.tauraaestheticclinic.co.uk/,"2-4 Kenway Rd, London SW5 0RR, United Kingdom",+442039314008,"Skin care clinic, Beauty salon, Facial spa",5,
Este Medical - Hair Transplant & Skin Clinic London,https://www.estemedicalgroup.uk/clinics/london?utm_source=google_profile&utm_campaign=localo&utm_medium=mainlink,"14-15 Child's Pl, London SW5 9RX, United Kingdom",+442045040780,"Hair transplantation clinic, Hair removal service, Laser hair removal service, Skin care clinic",4.8,
No Filter Clinic,https://www.nofilterclinic.com/,"9 Young St, London W8 5EH, United Kingdom",+442033438431,"Medical clinic, Skin care clinic",4.9,
Nicole Zysk Aesthetics,https://nicolezysk.co.uk/,"5 Kensington High St, London W8 5NP, United Kingdom",+447500771693,"Permanent make-up clinic, Beauty salon, Dermatologist, Laser hair removal service, Laser tag center, Skin care clinic",4.8,
Arenas Spa & Beauty,https://phorest.com/book/salons/arenasspabeauty,"10a, S Lambeth Rd, London SW8 1QT, United Kingdom",+442045688798,"Spa, Beauty salon, Facial spa, Lymph drainage therapist, Massage spa, Massage therapist, Reflexologist, Sports massage therapist",4.9,
S.Spa London,https://www.sliquespa.net/?utm_source=yell&utm_medium=referral&utm_campaign=yell,"95 Streatham Hill, London SW2 4UD, United Kingdom",+442086747814,"Day spa, Beauty salon, Facial spa, Massage spa, Nail salon, Sauna, Skin care clinic, Waxing hair removal service",4.7,
Belle Vous Spa - Nine Elms,http://www.bellevousspa.com/,"347 Wandsworth Rd, London SW8 2JH, United Kingdom",+442076226364,"Day spa, Esthetics service, Facial spa, Laser hair removal service, Massage spa, Public bath, Public sauna, Tattoo removal service, Waxing hair removal service, Weight loss service",4.6,
Glow Aesthetics,,"Castle Square, 40 Elephant Rd, London SE17 1EU, United Kingdom",+447874816645,"Medical spa, Beauty salon",5,
Dr Smith Aesthetics,https://www.lsmithaesthetics.com/,"Ink Beauty, 341 Kennington Rd, London SE11 4QE, United Kingdom",+447835959075,Medical spa,5,
Face Lab Aesthetics,http://www.facelab.uk/,"Mazu, 34 Clapham Rd, London SW9 0JQ, United Kingdom",+447518407788,"Medical spa, Cosmetics industry, Skin care clinic",5,
The Spa at Park Hyatt London River Thames,https://www.hyatt.com/en-US/spas/The-Spa-At-Park-Hyatt-London-River-Thames/home,"7 Nine Elms Ln, Nine Elms, London SW8 5PH, United Kingdom",+442035034255,"Spa, Gym, Indoor swimming pool, Massage spa, Massage therapist, Sauna, Spa and health club, Wellness center",4.8,
Aesthetics & Skin By Yara,https://www.aestheticsandskinbyyara.co.uk/,"40 Moreton St, Pimlico, London SW1V 2PB, United Kingdom",+447482343595,Medical spa,5,
London Skin Wellness House,http://www.londonskinwellness.co.uk/,"131 Lower Marsh, London SE1 7AE, United Kingdom",+442079289111,"Laser hair removal service, Skin care clinic, Sports massage therapist",4.9,
Even Thai Spa,https://www.eventhaispa.com/,"329 Kennington Rd, London SE11 4QE, United Kingdom",+447736243683,Thai massage therapist,4.9,
Agua London,https://www.seacontainerslondon.com/unwind/agua-spa-london/?utm_source=google&utm_medium=local&utm_campaign=spa-agua,"20 Upper Ground, London SE1 9PD, United Kingdom",+442037471010,"Spa, Facial spa, Massage therapist",4.6,
Dr Motox,http://www.drmotox.com/,"36 Bromell's Rd, London SW4 0BN, United Kingdom",+447389777495,"Medical spa, Cosmetics industry, Facial spa, Skin care clinic",5,
Dr Savannah Aesthetics,https://bit.ly/DrSavannahAesthetics,"Make Me Feel Parapharmacie, 25 Abbeville Rd, London SW4 9LA, United Kingdom",,Medical spa,5,
Health Aura Medi Spa,,"1A Streatham Hill, Cricklade Ave, London SW2 3HD, United Kingdom",+447591482007,Weight loss service,5,
PERSONAL BEST AESTHETICS LTD,https://www.pbaesthetics.co.uk/,"Personal Best Aesthetics- Quetzal Studio, 125 Dulwich Rd, London SE24 0NG, United Kingdom",+447858315443,Medical spa,5,
Emma Wilson Urban Spa,http://www.emmawilsonurbanspa.co.uk/,"108C Streatham High Rd, London SW16 1BW, United Kingdom",+442087699764,"Beauty salon, Facial spa, Massage therapist, Nail salon, Spa",4.9,
Touch by Kimani Skincare & Wellness Treatment,https://touchbykimani.com/,"Juxon St, London SE11 6NH, United Kingdom",+447508436794,"Massage therapist, Facial spa, Skin care clinic, Waxing hair removal service",4.9,
Good Genetics Aesthetics,http://www.goodgenetics.co.uk/,"7 Denbigh Mews, Pimlico, London SW1V 2HF, United Kingdom",+447503793750,"Medical spa, Skin care clinic",5,
Sculpt Skin Spa,https://www.sculptskinspa.com/,"19 Page's Walk, London SE1 4SB, United Kingdom",+442078707876,Medical spa,5,
Riazthetics Clinic - Victoria,https://www.riazthetics.com/,"75 Wilton Rd, Pimlico, London SW1V 1DE, United Kingdom",+447706395358,"Medical spa, Health and beauty shop, Skin care clinic",5,
DH Aesthetics Clinic Ltd,https://www.dhaestheticsclinic.com/,"44 Wood St, Kingston upon Thames KT1 1UW, Regatul Unit",+447570494300,"Centru medical de înfrumusețare, Salon de înfrumusețare, Tratament cosmetic facial, Clinică de îngrijire a pielii",5,
It's Me and You Clinic,https://itsmeandyou.co.uk/,"50 Canbury Park Rd, Kingston upon Thames KT2 6LX, Regatul Unit",+447754339478,"Centru medical de înfrumusețare, Clinică de îngrijire a pielii",5,
Eleganza Aesthetics Ltd,https://www.eleganzaaesthetics.co.uk/,"16 Thames St, London, Kingston upon Thames KT1 1PE, Regatul Unit",+447777611688,"Centru medical de înfrumusețare, Clinică de îngrijire a pielii",5,
The Leading Clinic at Royal Kingston,https://www.tlcark.com/,"Unit 1, Baring House, 1A Manorgate Rd, Kingston upon Thames KT2 7AW, Regatul Unit",+442084129796,"Clinică de îngrijire a pielii, Estetician, Medic de familie, Servicii de epilare cu laser, Serviciul de Sănătate Ocupațională, Medic",5,
Skinfinity By Hiba Rihan,http://www.skinfinitybyhibarihan.com/,"Parc House, Skinfinity, Studios, Cowleaze Rd, Kingston upon Thames KT2 6DZ, Regatul Unit",+447411161610,Clinică de îngrijire a pielii,5,
Laser Clinics UK - Kingston,https://www.laserclinics.co.uk/skin-care-clinics/kingston/?utm_source=google&utm_medium=organic&utm_campaign=Google%20My%20Business%20Page&utm_content=Kingston&utm_term=plcid_126433574873358008,"The Bentall Centre, Wood St, Kingston upon Thames KT1 1TP, Regatul Unit",+442087060765,"Servicii de epilare cu laser, Salon de înfrumusețare, Magazin de cosmetice, Tratament cosmetic facial, Centru medical de înfrumusețare, Clinică de îngrijire a pielii",4.6,
KONCEPT® Medical Clinic,https://konceptmedicalclinic.com/,"46 - 48 Wood St, Kingston upon Thames KT1 1UW, Regatul Unit",+442081291011,"Servicii de epilare cu laser, Dermatolog, Serviciu de estetică, Medic de familie, Centru medical, Serviciul de Sănătate Ocupațională",4.7,
Aisha Khayat | The Skin Studio,https://www.aishakhayat.com/,"Private Clinic, 1 Beverley Ln, Coombe Neville, Kingston upon Thames KT2 7EE, Regatul Unit",+447470007037,"Salon de înfrumusețare, Centru medical de înfrumusețare",4.8,
The Aesthetic Box,https://www.theaestheticbox.co.uk/,"St Georges Square, New Malden KT3 4HG, Regatul Unit",+447759491333,Centru medical de înfrumusețare,4.9,
Pretty Fit Aesthetics Ltd,http://www.prettyfitaesthetics.co.uk/,"94 Richmond Rd, Kingston upon Thames KT2 5EN, Regatul Unit",+447770795015,Salon de înfrumusețare,4.8,
Premier Laser & Skin Kingston,https://londonpremierlaser.co.uk/?utm_source=googlemybusiness&utm_medium=organic&utm_campaign=google+my+business+-+kingston,"4 Eden St, Kingston upon Thames KT1 1BB, Regatul Unit",+442085467777,"Servicii de epilare cu laser, Salon de înfrumusețare, Clinică de îngrijire a pielii, Serviciu de îndepărtare a tatuajelor",4.7,
Thérapie Clinic - Kingston,https://therapieclinic.com/locations/kingston?utm_source=google&utm_medium=organic&utm_campaign=gmb&utm_content=kingston,"Unit G36, bentall Centre, London KT1 1TP, Regatul Unit",+442081140311,Servicii de epilare cu laser,4.7,
Muna Aesthetics,https://www.munaaesthetics.com/,"Upstairs A&G Hairdressing, 16 Thames St, Kingston upon Thames KT1 1PE, Regatul Unit",+447846818607,Centru medical de înfrumusețare,5,
The Laser & Aesthetics Clinic,https://www.the-laser-aesthetics.co.uk/?utm_source=google&utm_medium=wix_google_business_profile&utm_campaign=11243035356601265019,"16 The Triangle, Kingston upon Thames KT1 3RT, Regatul Unit",+442082260029,Servicii de epilare cu laser,5,
Kingston Laser Clinic,https://www.kingstonlaser.co.uk/,"31 High St, Hampton Wick, Kingston upon Thames KT1 4DA, Regatul Unit",+442089435381,"Salon de înfrumusețare, Serviciu de depilare prin electroliză, Servicii de epilare cu laser, Maseur, Clinică de îngrijire a pielii, Serviciu de epilare cu ceară",4.5,
Ethos Skin and Laser,http://www.ethosskinandlaser.co.uk/,"190 Kingston Rd, Teddington TW11 9JD, Regatul Unit",+442081266000,"Salon de înfrumusețare, Estetician, Tratament cosmetic facial, Servicii de epilare cu laser, Salon de make-up, Centru medical de înfrumusețare, Clinică de îngrijire a pielii",4.9,
Kingston Aesthetics,http://www.kingstonaesthetics.co.uk/,"Aesthetics, 55c Eden St, Kingston upon Thames KT1 1BW, Regatul Unit",+447359673679,Clinică de îngrijire a pielii,5,
Health Life,http://health-life.co/,"55c Eden St, Kingston upon Thames KT1 1BW, Regatul Unit",+447784521555,"Maseur, Massage parlor, Terapeut specializat în masaj sportiv, Terapeut specialist în masaj thailandez",4.8,
Kingston Health Studio,https://www.kingstonhealthstudio.co.uk/,"Eden Walk, 8 Alderman judge, Kingston upon Thames KT1 1BS, Regatul Unit",+447886658933,Salon de înfrumusețare,5,
Nakedhealth,http://www.nakedhealth.co.uk/,"261-263 Coombe Ln, West Wimbledon, London SW20 0RH, Regatul Unit",+442089445454,"Centru medical de înfrumusețare, Laborator de analize medicale, Chirurg cosmetician, Magazin de cosmetice, Servicii de piercing în urechi, Serviciu de depilare prin electroliză, Servicii de epilare cu laser, Chirurg plastician, Clinică de îngrijire a pielii, Serviciu de îndepărtare a tatuajelor",5,
Glow Aesthetics,,"Castle Square, 40 Elephant Rd, London SE17 1EU, Birleşik Krallık",+447874816645,"Tedavi Amaçlı Kaplıca, Güzellik Salonu",5,
Dr Smith Aesthetics,https://www.lsmithaesthetics.com/,"Ink Beauty, 341 Kennington Rd, London SE11 4QE, Birleşik Krallık",+447835959075,Tedavi Amaçlı Kaplıca,5,
Face Lab Aesthetics,http://www.facelab.uk/,"Mazu, 34 Clapham Rd, London SW9 0JQ, Birleşik Krallık",+447518407788,"Tedavi Amaçlı Kaplıca, Kozmetik Sektörü, Cilt Bakım Kliniği",5,
Good Genetics Aesthetics,http://www.goodgenetics.co.uk/,"7 Denbigh Mews, Pimlico, London SW1V 2HF, Birleşik Krallık",+447503793750,"Tedavi Amaçlı Kaplıca, Cilt Bakım Kliniği",5,
Eudelo,https://www.eudelo.com/,"63 Bondway, London SW8 1SJ, Birleşik Krallık",+442071189500,"Tedavi Amaçlı Kaplıca, Lazer Epilasyon Hizmeti, Sağlık Ocağı, Dermatolog",4.8,
Nine Elms Clinic,http://www.nineelmsclinic.com/,"159, Sky Gardens, Wandsworth Rd, London SW8 2GB, Birleşik Krallık",+442075640050,"Cilt Bakım Kliniği, Dermatolog, Doktor, Lazer Epilasyon Hizmeti, Tıp Merkezi, Sağlık Ocağı, Çocuk Doktoru, Fizik Tedavi Uzmanı, Pratisyen Doktor",4.9,
Riazthetics Clinic - Victoria,https://www.riazthetics.com/,"75 Wilton Rd, Pimlico, London SW1V 1DE, Birleşik Krallık",+447706395358,"Tedavi Amaçlı Kaplıca, Sağlık ve Güzellik Merkezi, Cilt Bakım Kliniği",5,
Aesthetics & Skin By Yara,https://www.aestheticsandskinbyyara.co.uk/,"40 Moreton St, Pimlico, London SW1V 2PB, Birleşik Krallık",+447482343595,Tedavi Amaçlı Kaplıca,5,
One Aesthetics Clinic,https://oneaestheticsclinic.com/?utm_source=Google&utm_medium=Organic&utm_campaign=GBP-listing,"62 Coldharbour Ln, London SE5 9PU, Birleşik Krallık",+442039870044,"Tedavi Amaçlı Kaplıca, Dermatolog, Sağlık Ocağı, Cilt Bakım Kliniği",5,
NOBLE London,https://www.nobleaesthetics.co.uk/,"1 Meade Mews, London SW1P 4EG, Birleşik Krallık",+447838937188,Tedavi Amaçlı Kaplıca,4.9,
ARC Clinic,https://arcclinic.co.uk/,"4th Floor, 10 Adam St, London WC2N 6AA, Birleşik Krallık",+447549262096,"Tedavi Amaçlı Kaplıca, Sağlık ve Güzellik Merkezi, Lazer Epilasyon Hizmeti",5,
Ink Beauty Skin Clinic,https://inkbeautyskinclinic.com/,"341 Kennington Rd, London SE11 4QE, Birleşik Krallık",+447709181761,Tedavi Amaçlı Kaplıca,5,
ID SKIN & WELLNESS COMPANY,https://www.idskincompany.com/,"48 Warwick Wy, Pimlico, London SW1V 1RY, Birleşik Krallık",+442078285602,Tedavi Amaçlı Kaplıca,5,
Bespoke Medispa,https://newukdetails.top/details/bespoke-medispa-ChIJpeA,"11 Greek St, London W1D 4DJ, Birleşik Krallık",+447912102070,"Tedavi Amaçlı Kaplıca, Sağlık Kaplıcası, Sağlıklı Yaşam Merkezi",4.8,
Sculpt Skin Spa,https://www.sculptskinspa.com/,"19 Page's Walk, London SE1 4SB, Birleşik Krallık",+442078707876,Tedavi Amaçlı Kaplıca,5,
AMS Aesthetics,https://amsaesthetics.com/?utm_source=Google&utm_medium=Organic&utm_campaign=GBP-listing,"21 Tabard St, London SE1 4LA, Birleşik Krallık",+447700168083,"Tedavi Amaçlı Kaplıca, Cilt Bakım Kliniği",5,
Transcend Wellness London,https://www.transcendwellness.london/,"entrance via, 10a Bath Passage, Eden St, Kingston upon Thames KT1 1BB, Vương quốc Anh",+442080583456,"Trung tâm chăm sóc sức khỏe, Bác sĩ y học cao áp, Massage parlor, Spa mát xa, Nhà tắm hơi, Chương trình chăm sóc sức khỏe",5,
Health Life,http://health-life.co/,"55c Eden St, Kingston upon Thames KT1 1BW, Vương quốc Anh",+447784521555,"Bác sĩ trị liệu xoa bóp, Massage parlor, Nhân viên trị liệu mát-xa thể thao, Nhân viên trị liệu mát-xa kiểu Thái",4.8,
Blissful Float Spa,https://www.blissfulfloatspa.com/,"31 Fife Road Kingston upon Thames, Greater, London KT1 1SF, Vương quốc Anh",+442070187377,"Trung tâm chăm sóc sức khỏe, Spa ban ngày",5,
DH Aesthetics Clinic Ltd,https://www.dhaestheticsclinic.com/,"44 Wood St, Kingston upon Thames KT1 1UW, Vương quốc Anh",+447570494300,"Spa y tế, Thẩm mỹ viện, Spa mặt, Cơ sở chăm sóc da",5,
Aisha Khayat | The Skin Studio,https://www.aishakhayat.com/,"Private Clinic, 1 Beverley Ln, Coombe Neville, Kingston upon Thames KT2 7EE, Vương quốc Anh",+447470007037,"Thẩm mỹ viện, Spa y tế",4.8,
Kingston Health Studio,https://www.kingstonhealthstudio.co.uk/,"Eden Walk, 8 Alderman judge, Kingston upon Thames KT1 1BS, Vương quốc Anh",+447886658933,Thẩm mỹ viện,5,
Vitality Massage & Beauty,http://vitality.mytreatwell.co.uk/,"15 High St, Hampton Wick, Kingston upon Thames KT1 4DA, Vương quốc Anh",+447710798119,Bác sĩ trị liệu xoa bóp,4.9,
PedicureProLine Beauty & Aesthetic Centre,http://www.pedicureproline.co.uk/,"7-9 Eden St, Kingston upon Thames KT1 1BQ, Vương quốc Anh",+442080681818,"Thẩm mỹ viện, Chuyên gia làm đẹp, Cửa hàng mỹ phẩm, Quầy làm lông mày, Tiệm làm mi, Spa mặt, Nghệ sĩ trang điểm, Spa mát xa, Bác sĩ trị liệu xoa bóp, Tiệm chăm sóc móng",4.5,
It's Me and You Clinic,https://itsmeandyou.co.uk/,"50 Canbury Park Rd, Kingston upon Thames KT2 6LX, Vương quốc Anh",+447754339478,"Spa y tế, Cơ sở chăm sóc da",5,
Thérapie Clinic - Kingston,https://therapieclinic.com/locations/kingston?utm_source=google&utm_medium=organic&utm_campaign=gmb&utm_content=kingston,"Unit G36, bentall Centre, London KT1 1TP, Vương quốc Anh",+442081140311,Dịch vụ tẩy lông bằng la-de,4.7,
The Aesthetic Box,https://www.theaestheticbox.co.uk/,"St Georges Square, New Malden KT3 4HG, Vương quốc Anh",+447759491333,Spa y tế,4.9,
Laser Clinics UK - Kingston,https://www.laserclinics.co.uk/skin-care-clinics/kingston/?utm_source=google&utm_medium=organic&utm_campaign=Google%20My%20Business%20Page&utm_content=Kingston&utm_term=plcid_126433574873358008,"The Bentall Centre, Wood St, Kingston upon Thames KT1 1TP, Vương quốc Anh",+442087060765,"Dịch vụ tẩy lông bằng la-de, Thẩm mỹ viện, Công nghiệp mỹ phẩm, Spa mặt, Spa y tế, Cơ sở chăm sóc da",4.6,
Serenity Salon,http://www.serenity-salon.co.uk/,"16 Kingston Hill, Kingston upon Thames KT2 7NH, Vương quốc Anh",+442085466966,"Thẩm mỹ viện, Spa mặt, Dịch vụ tẩy lông bằng la-de, Bác sĩ trị liệu xoa bóp, Dịch vụ tẩy lông bằng sáp",4.8,
Eleganza Aesthetics Ltd,https://www.eleganzaaesthetics.co.uk/,"16 Thames St, London, Kingston upon Thames KT1 1PE, Vương quốc Anh",+447777611688,"Spa y tế, Cơ sở chăm sóc da",5,
Nakedhealth,http://www.nakedhealth.co.uk/,"261-263 Coombe Ln, West Wimbledon, London SW20 0RH, Vương quốc Anh",+442089445454,"Spa y tế, Dịch vụ xét nghiệm máu, Bác sĩ phẫu thuật thẩm mỹ, Cửa hàng mỹ phẩm, Dịch vụ bấm lỗ tai, Dịch vụ tẩy lông bằng điện, Dịch vụ tẩy lông bằng la-de, Phẫu thuật tạo hình, Cơ sở chăm sóc da, Dịch vụ xóa hình xăm",5,
Ethos Skin and Laser,http://www.ethosskinandlaser.co.uk/,"190 Kingston Rd, Teddington TW11 9JD, Vương quốc Anh",+442081266000,"Thẩm mỹ viện, Chuyên gia làm đẹp, Spa mặt, Dịch vụ tẩy lông bằng la-de, Nghệ sĩ trang điểm, Spa y tế, Cơ sở chăm sóc da",4.9,
Muna Aesthetics,https://www.munaaesthetics.com/,"Upstairs A&G Hairdressing, 16 Thames St, Kingston upon Thames KT1 1PE, Vương quốc Anh",+447846818607,Spa y tế,5,
London Massage Therapy,http://www.londonmassagetherapy.co.uk/,"Natural Health Centre, 31 Old London Rd, Kingston upon Thames KT2 6ND, Vương quốc Anh",+447738942518,"Bác sĩ trị liệu xoa bóp, Thẩm mỹ viện, Spa sức khỏe, Massage parlor, Spa mát xa",5,
360 Degree Clinic,https://www.360degreeclinic.co.uk/,"58A Victoria Rd, Surbiton KT6 4NQ, Vương quốc Anh",+442039714025,"Trung tâm chăm sóc sức khỏe, Dịch vụ xét nghiệm máu, Spa mặt, Dịch vụ tẩy lông bằng la-de, Nhà dinh dưỡng học, Cơ sở chăm sóc da",4.7,
Thai Remedial Therapy,https://www.thairemedialtherapy.com/,"1-2 Home Park Terrace, Parade, Hampton Wick, Kingston upon Thames KT1 4BY, Vương quốc Anh",+447454411668,Spa mát xa,5,
Premier Laser & Skin Kingston,https://londonpremierlaser.co.uk/?utm_source=googlemybusiness&utm_medium=organic&utm_campaign=google+my+business+-+kingston,"4 Eden St, Kingston upon Thames KT1 1BB, United Kingdom",+442085467777,"Laser hair removal service, Beauty salon, Skin care clinic, Tattoo removal service",4.7,
The Leading Clinic at Royal Kingston,https://www.tlcark.com/,"Unit 1, Baring House, 1A Manorgate Rd, Kingston upon Thames KT2 7AW, United Kingdom",+442084129796,"Skin care clinic, Beautician, Family practice physician, Laser hair removal service, Occupational health service, Doctor",5,
Laser Clinics UK - Kingston,https://www.laserclinics.co.uk/skin-care-clinics/kingston/?utm_source=google&utm_medium=organic&utm_campaign=Google%20My%20Business%20Page&utm_content=Kingston&utm_term=plcid_126433574873358008,"The Bentall Centre, Wood St, Kingston upon Thames KT1 1TP, United Kingdom",+442087060765,"Laser hair removal service, Beauty salon, Cosmetics industry, Facial spa, Medical spa, Skin care clinic",4.6,
Skinfinity By Hiba Rihan,http://www.skinfinitybyhibarihan.com/,"Parc House, Skinfinity, Studios, Cowleaze Rd, Kingston upon Thames KT2 6DZ, United Kingdom",+447411161610,Skin care clinic,5,
Lumiderm Skin Clinic,https://lumidermskinclinic.co.uk/,"Suite 2, 5 Crown Passage, Kingston upon Thames KT1 1JD, United Kingdom",+447845253259,Skin care clinic,5,
Thérapie Clinic - Kingston,https://therapieclinic.com/locations/kingston?utm_source=google&utm_medium=organic&utm_campaign=gmb&utm_content=kingston,"Unit G36, bentall Centre, London KT1 1TP, United Kingdom",+442081140311,Laser hair removal service,4.7,
It's Me and You Clinic,https://itsmeandyou.co.uk/,"50 Canbury Park Rd, Kingston upon Thames KT2 6LX, United Kingdom",+447754339478,"Skin care clinic, Medical spa",5,
DB Skin Clinic,https://dbskinclinic.co.uk/,"2 Bridle Cl, Kingston upon Thames KT1 2JW, United Kingdom",+447973481064,"Skin care clinic, Beautician",5,
DH Aesthetics Clinic Ltd,https://www.dhaestheticsclinic.com/,"44 Wood St, Kingston upon Thames KT1 1UW, United Kingdom",+447570494300,"Skin care clinic, Beauty salon, Facial spa, Medical spa",5,
The Beauty Clinic,http://www.thebeautyclinicuk.com/,"128A London Rd, Kingston upon Thames KT2 6QJ, United Kingdom",+442085494200,"Beauty salon, Facial spa, Hair removal service, Hair salon, Nail salon, Waxing hair removal service",4.5,
Kingston Laser Clinic,https://www.kingstonlaser.co.uk/,"31 High St, Hampton Wick, Kingston upon Thames KT1 4DA, United Kingdom",+442089435381,"Beauty salon, Electrolysis hair removal service, Laser hair removal service, Massage therapist, Skin care clinic, Waxing hair removal service",4.5,
The Laser & Aesthetics Clinic,https://www.the-laser-aesthetics.co.uk/?utm_source=google&utm_medium=wix_google_business_profile&utm_campaign=11243035356601265019,"16 The Triangle, Kingston upon Thames KT1 3RT, United Kingdom",+442082260029,Laser hair removal service,5,
Pretty Fit Aesthetics Ltd,http://www.prettyfitaesthetics.co.uk/,"94 Richmond Rd, Kingston upon Thames KT2 5EN, United Kingdom",+447770795015,Beauty salon,4.8,
BLC - Bottoxx & Laser Clinic,https://bottoxxandlaserclinic.co.uk/,"162 London Rd, Kingston upon Thames KT2 6QW, United Kingdom",+442034110046,Skin care clinic,4.9,
Kingston Aesthetics,http://www.kingstonaesthetics.co.uk/,"Aesthetics, 55c Eden St, Kingston upon Thames KT1 1BW, United Kingdom",+447359673679,Skin care clinic,5,
Eleganza Aesthetics Ltd,https://www.eleganzaaesthetics.co.uk/,"16 Thames St, London, Kingston upon Thames KT1 1PE, United Kingdom",+447777611688,"Skin care clinic, Medical spa",5,
KONCEPT® Medical Clinic,https://konceptmedicalclinic.com/,"46 - 48 Wood St, Kingston upon Thames KT1 1UW, United Kingdom",+442081291011,"Laser hair removal service, Dermatologist, Family practice physician, Medical Center, Occupational health service",4.7,
Aisha Khayat | The Skin Studio,https://www.aishakhayat.com/,"Private Clinic, 1 Beverley Ln, Coombe Neville, Kingston upon Thames KT2 7EE, United Kingdom",+447470007037,"Beauty salon, Medical spa",4.8,
Banning Dental Group and Skin Clinique - Kingston,https://banningdental.co.uk/locations/kingston/?utm_source=google&utm_medium=organic&utm_campaign=gbp_kingston,"7 Brook St, Kingston upon Thames KT1 2EY, United Kingdom",+442045310900,"Skin care clinic, Cosmetic dentist, Dental hygienist, Emergency dental service, Orthodontist, Dentist, Teeth whitening service",5,
Quidsia Al-Noor Aesthetics,https://quidsiaal-nooraesthetics.mytreatwell.co.uk/,"Office 7, Kingston Hill, Kingston upon Thames KT2 7PW, United Kingdom",+447796829000,Skin care clinic,5,
KONCEPT® Medical Clinic,https://konceptmedicalclinic.com/,"46 - 48 Wood St, Kingston upon Thames KT1 1UW, Vương quốc Anh",+442081291011,"Trung tâm y tế, Bác sĩ da liễu, Bác sĩ thực hành tại nhà, Dịch vụ tẩy lông bằng la-de, Dịch vụ sức khỏe nghề nghiệp",4.7,
The Beauty Clinic,http://www.thebeautyclinicuk.com/,"128A London Rd, Kingston upon Thames KT2 6QJ, Vương quốc Anh",+442085494200,"Thẩm mỹ viện, Spa mặt, Dịch vụ tẩy lông, Hiệu làm tóc, Tiệm chăm sóc móng, Dịch vụ tẩy lông bằng sáp",4.5,
The Aesthetic Box,https://www.theaestheticbox.co.uk/,"St Georges Square, New Malden KT3 4HG, United Kingdom",+447759491333,Medical spa,4.9,
