name,website,address,phone,category,rating,reviews_count
DMC Aesthetics,https://dmcaesthetics.com/,"19 Beauchamp Pl, London SW3 1NQ, Regno Unito",+442072250777,"Centro benessere medico, Centro estetico, Centro benessere per trattamenti al viso, Servizio di depilazione, Clinica per la cura della pelle",4.9,
Medical Center Knightsbridge,https://www.casablancaclinic.uk/,"156 Brompton Rd, London SW3 1HW, Regno Unito",+447539105450,"Clinica per la cura della pelle, Negozio di prodotti di bellezza e per il benessere",4.9,
The Lovely Clinic,http://thelovelyclinic.co.uk/,"8 Beauchamp Pl, London SW3 1NQ, Regno Unito",+442036955400,"Centro benessere medico, Clinica per la cura della pelle",4.9,
Derma Medica,https://www.dermamedica.co.uk/?utm_source=GMB&utm_medium=GMB&utm_campaign=GMB_Link&utm_id=GMB,"4 Cheval Pl, London SW7 1ES, Regno Unito",+441628476550,"Centro benessere medico, Medico, Medico di base, Clinica per la cura della pelle",4.9,
Knightsbridge-Aesthetics,,"1C Brompton Pl, London SW3 1QE, Regno Unito",,Clinica medica,5,
VVV Beauty Clinic,https://vvvbeauty.co.uk/clinic,"Brompton Pl, London SW3 1QE, Regno Unito",+447540686159,Centro estetico,4.6,
Knightsbridge Advanced Beauty,https://www.knightsbridgeadvancedbeauty.co.uk/,"118 Knightsbridge, London SW1X 7PF, Regno Unito",+442072253695,"Clinica per la cura della pelle, Corso di body shaping, Centro benessere per trattamenti al viso, Servizio di depilazione, Servizio di sostituzione dei capelli, Salone di manicure",4.8,
Lux Clinic,http://luxclinic.co.uk/,"3rd Floor, 21 Knightsbridge, London SW1X 7LY, Regno Unito",+447399335445,"Centro benessere medico, Clinica per la cura della pelle",4.9,
Taktouk Clinic,http://www.drwassimtaktouk.com/,"56, Knightsbridge Court, 12 Sloane St, London SW1X 9LJ, Regno Unito",+442072357198,Clinica per la cura della pelle,5,
The London Academy of Aesthetic Medicine,http://www.thelaam.co.uk/,"56, Knightsbridge Court, 12 Sloane St, London SW1X 9LJ, Regno Unito",+447488845634,Centro di formazione,4.9,
Young LDN,https://www.youngldn.com/,"228 Westbourne Grove, London W11 2RH, Reino Unido",+442083543970,"Spa terapéutico, Proveedor de productos de belleza, Centro de estética, Industria de cosméticos, Centro de depilación láser, Salón de manicura y pedicura, Clínica dermatológica, Spa",5,
Koia,https://www.koia.london/,"32-34 Notting Hill Gate, London W11 3HX, Reino Unido",+442072298686,"Spa, Esteticista facial, Massage spa, Osteópata, Masajista deportivo",4.9,
The Well Clinic,https://thewell-clinic.com/,"8-9 Lambton Pl, London W11 2SH, Reino Unido",+442072212248,"Spa terapéutico, Centro de estética, Especialista en medicina holística, Centro de depilación láser, Masajista, Clínica dermatológica, Salón de manicura y pedicura, Osteópata, Centro de adelgazamiento, Centro de salud y bienestar",4.8,
"Cloud Twelve Wellness, Spa and Kid's Club",https://www.cloudtwelve.co.uk/,"2-5 Colville Mews, London W11 2DA, Reino Unido",+442033011012,"Spa y gimnasio, Children's club, Esteticista facial, Massage spa, Naturópata, Peluquería, Centro de salud y bienestar",4.9,
SkinWell Aesthetics Boutique,https://www.skinwellaesthetics.co.uk/,"Studio 4, Within The Tanning Shop, Lower Ground Floor, 12 Notting Hill Gate, London W11 3JE, Reino Unido",+447841046759,"Spa terapéutico, Centro de depilación láser, Clínica ambulatoria",4.9,
Ayanna Spa,http://www.ayannaspa.co.uk/,"146 Holland Park Ave, London W11 4UE, Reino Unido",+442079987872,"Centro de estética, Esteticista facial, Tienda de belleza y salud, Massage spa, Salón de manicura y pedicura, Clínica dermatológica, Depilación con cera",4.8,
Skinglow Clinic,http://www.skinglowclinic.co.uk/,"216 Kensington Park Rd, London W11 1NR, Reino Unido",+442073139641,"Spa terapéutico, Centro de estética, Esteticista facial, Clínica dermatológica",5,
Apogii Clinic (Get A Drip),https://www.apogiiclinic.co.uk/?utm_source=GMB&utm_medium=GMB&utm_campaign=website,"105 Westbourne Grove, London W2 4UW, Reino Unido",+442072298580,"Centro de salud y bienestar, Centro de estética, Balneario, Massage spa, Clínica dermatológica",4.8,
Spa Experience Kensington,https://www.spaexperience.org.uk/locations/kensington?utm_source=google&utm_medium=organic&utm_campaign=google_my_business,"Kensington Leisure Centre, Bomore Rd, London W10 6EX, Reino Unido",+442037938220,"Spa, Spa de día, Masajista, Spa y gimnasio",3.8,
Spa & Massage Bayswater,http://www.spaandmassage.co.uk/,"123 Queensway, London W2 4SJ, Reino Unido",+442033421789,"Massage spa, Spa de día, Masajista, Masajista deportivo",4.9,
Asthetik London,http://www.asthetiklondon.com/,"@BodyworksWest, 11 Lambton Pl, London W11 2SH, Reino Unido",+442037515122,"Spa terapéutico, Médico, Centro de depilación láser, Clínica dermatológica, Clínica especializada",5,
Skin Matters,https://skin-matters.co.uk/,"Skin-Matters, 119B Portland Rd, London W11 4LN, Reino Unido",+442077926999,"Clínica dermatológica, Esteticista facial",5,
Mell Aesthetics Brazilian Clinic in Holland Park,https://mellaesthetics.mytreatwell.co.uk/,"3 Bramley Rd, London W10 6SZ, Reino Unido",+447475252607,"Spa terapéutico, Industria de cosméticos, Esteticista facial, Clínica dermatológica",5,
Asthetik London,http://www.asthetiklondon.com/,"@BodyworksWest, 11 Lambton Pl, London W11 2SH, United Kingdom",+442037515122,"Medical spa, Physician, Laser hair removal service, Skin care clinic, Specialized clinic",5,
SkinWell Aesthetics Boutique,https://www.skinwellaesthetics.co.uk/,"Studio 4, Within The Tanning Shop, Lower Ground Floor, 12 Notting Hill Gate, London W11 3JE, United Kingdom",+447841046759,"Medical spa, Esthetics service, Laser hair removal service, Medical clinic",4.9,
The Well Clinic,https://thewell-clinic.com/,"8-9 Lambton Pl, London W11 2SH, United Kingdom",+442072212248,"Medical spa, Beauty salon, Holistic medicine practitioner, Laser hair removal service, Massage therapist, Skin care clinic, Nail salon, Osteopath, Weight loss service, Wellness center",4.8,
Clinic Platina,http://www.clinicplatina.com/,"24b Notting Hill Gate, London W11 3JE, United Kingdom",+442082260165,Skin care clinic,5,
The Clinic Holland Park,https://theclinichollandpark.com/,"142-144 Holland Park Ave, London W11 4UE, United Kingdom",+442039982600,"Medical clinic, Dermatologist, Health and beauty shop, Laser hair removal service, Ophthalmology clinic, Plastic surgery clinic, Skin care clinic, Surgical center",4.9,
Mell Aesthetics Brazilian Clinic in Holland Park,https://mellaesthetics.mytreatwell.co.uk/,"3 Bramley Rd, London W10 6SZ, United Kingdom",+447475252607,"Medical spa, Cosmetics industry, Facial spa, Skin care clinic",5,
Young LDN,https://www.youngldn.com/,"228 Westbourne Grove, London W11 2RH, United Kingdom",+442083543970,"Medical spa, Beauty product supplier, Beauty salon, Cosmetics industry, Laser hair removal service, Nail salon, Skin care clinic, Spa",5,
Skinglow Clinic,http://www.skinglowclinic.co.uk/,"216 Kensington Park Rd, London W11 1NR, United Kingdom",+442073139641,"Medical spa, Beauty salon, Facial spa, Skin care clinic",5,
The Aesthetics Club,http://www.theaestheticsclub.co.uk/,"79 Westbourne Park Rd, London W2 5QH, United Kingdom",+442072292359,Skin care clinic,5,
Done in Notting Hill,https://www.instagram.com/doneinnottinghill?igsh=a3h4c2wwczh1aWI0&utm_source=qr,"Notting Hill Gate, London W11 4PR, United Kingdom",,"Skin care clinic, Beauty salon",5,
Injectual,http://www.injectual.com/,"59 Westbourne Grove, Greater, London W2 4UA, United Kingdom",+442039519115,Medical spa,5,
Skin Matters,https://skin-matters.co.uk/,"Skin-Matters, 119B Portland Rd, London W11 4LN, United Kingdom",+442077926999,"Skin care clinic, Facial spa",5,
Dias Clinic,https://widget.treatwell.co.uk/place/414314/menu/,"3B Wellington Ter, London W2 4LW, United Kingdom",+447862497077,"Spa, Beautician, Beauty product supplier, Specialized clinic, Sports massage therapist",4.9,
Adonia Medical Clinic,https://www.adoniamedicalclinic.co.uk/,"474 Harrow Rd, Maida Hill, London W9 3RU, United Kingdom",+442038757399,"Skin care clinic, Facial spa, Laser hair removal service",4.8,
Clinique de Paris,https://www.cliniquedeparis.uk/,"150 Barlby Rd, London W10 6BS, United Kingdom",+442080870987,"Skin care clinic, Health spa",5,
Re:Nu Dental & Medispa,https://renudentalmedispa.com/?utm_source=local&utm_medium=organic&utm_content=gmb,"20 Chepstow Rd, London W2 5BD, United Kingdom",+442081674185,"Medical spa, Dentist, Dental clinic, Orthodontist, Skin care clinic, Teeth whitening service",4.8,
TW AESTHETICS,https://www.tw-aesthetics.com/,"192C Campden Hill Rd, London W8 7TH, United Kingdom",+447717014598,Skin care clinic,5,
The Clinic Holland Park,https://theclinichollandpark.com/,"142-144 Holland Park Ave, London W11 4UE, Reino Unido",+442039982600,"Clínica ambulatoria, Dermatólogo, Tienda de belleza y salud, Centro de depilación láser, Clínica de oftalmología, Clínica de cirugía plástica, Clínica dermatológica, Surgical center",4.9,
Clinic Platina,http://www.clinicplatina.com/,"24b Notting Hill Gate, London W11 3JE, Reino Unido",+442082260165,Clínica dermatológica,5,
Done in Notting Hill,https://www.instagram.com/doneinnottinghill?igsh=a3h4c2wwczh1aWI0&utm_source=qr,"Notting Hill Gate, London W11 4PR, Reino Unido",,"Clínica dermatológica, Centro de estética",5,
Taktouk Clinic,http://www.drwassimtaktouk.com/,"56, Knightsbridge Court, 12 Sloane St, London SW1X 9LJ, Reino Unido",+442072357198,Clínica dermatológica,5,
Floralis Clinic,https://floralisclinic.co.uk/,"189 Brompton Rd, London SW3 1NE, Reino Unido",+447771112273,Clínica dermatológica,5,
Hazhi Beauty London,https://www.hazhibeauty.com/,"Unit 10, 281 Portobello Rd, London W10 5TZ, United Kingdom",+447826041449,"Skin care clinic, Beauty salon, Facial spa, Permanent make-up clinic",4.8,
Signature Clinic,https://signatureclinic.co.uk/,"73 St Charles Square, London W10 6EJ, United Kingdom",+443332070460,Plastic surgery clinic,4.4,
EverySkin,http://www.everyskinclinics.co.uk/,"43 Westbourne Grove, London W2 4UA, United Kingdom",+442031610640,Laser hair removal service,4.7,
LIIN & lipofirm pro clinic,http://www.girlbeauty.co.uk/,"37 Alexander St, London W2 5NU, United Kingdom",+447521169043,"Skin care clinic, Beautician, Beauty salon, Facial spa, Hair removal service",4.8,
Skin Lab Medispa - Marylebone,http://skinlabmedispa.co.uk/?utm_source=google&utm_medium=wix_google_business_profile&utm_campaign=3671584563679723166,"Unit 4, Light Centre Marylebone, 10 Portman Square, London W1H 6AZ, Storbritannien",+442034572046,Hudplejeklinik,5,
DrMediSpa,http://www.drmedispa.com/,"59 Chiltern St, London W1U 6NF, Storbritannien",+442084180362,"Hudplejeklinik, Klinik for plastikkirurgi",4.8,
Halcyon Medispa,https://halcyonmedispa.co.uk/,"2 Hinde St, London W1U 2AZ, Storbritannien",+442074863225,"Medicinsk spa, Hudlæge, Ansigtsbehandling, Laser-hårfjerning, Lægehus, Plastikkirurg, Klinik for plastikkirurgi, Hudplejeklinik, Wellnesscenter",4.8,
Spa at The Landmark London,https://www.landmarklondon.co.uk/spa-at-the-landmark-london/,"222 Marylebone Rd, London NW1 6JQ, Storbritannien",+442076318010,Spa,4.4,
ALTA,https://altamedispa.com/,"75-77 George St, London W1U 8AQ, Storbritannien",+447771116587,"Medicinsk spa, Hudlæge, Helse- og skønhedssalon, Hudplejeklinik, Plastikkirurg",5,
Marylebone Thai Spa,http://www.marylebonethaispa.co.uk/,"58A Paddington St, London W1U 4JA, Storbritannien",+442079352117,"Thaimassør, Massage parlor, Massage spa",4.5,
Artum,,"82A Baker St, London W1U 6AA, Storbritannien",+447849988789,"Skønhedssalon, Wellnesscenter, Ansigtsbehandling, Medicinsk spa, Hudplejeklinik",4.5,
GOOD,,"32 Devonshire Pl, London W1G 6JL, Storbritannien",+442071176776,"Medicinsk spa, Hudlæge",4.9,
Health And Beauty Lab - Marylebone,https://www.healthandbeautylab.eu/,"Room 5, 209 Old Marylebone Rd, London NW1 5QT, Storbritannien",+447918249545,"Medicinsk spa, Sundhedskonsulent, Helsecenter, Massør, Lægeklinik, Hudplejeklinik, Læge med speciale i smertebehandling, Klinik for plastikkirurgi",5,
Hydrafacial LDN Flagship,https://hydrafacial.co.uk/,"10 Portman Square, London W1H 6AZ, Storbritannien",,"Hudplejeklinik, Skønhedssalon",4.9,
Dr Jane Leonard,https://www.drjaneleonard.co.uk/,"1 Orchard St, London W1H 6HJ, Storbritannien",+447777782294,Medicinsk spa,4.9,
Chuan Body+Soul,http://www.langhamhotels.com/en/the-langham/london/wellness/chuan-body-soul/?htl=tllon&src=organic&eng=google&size=na&cid=chuan_yext_profile&y_source=1_MTAxMjgwNjItNzE1LWxvY2F0aW9uLndlYnNpdGU%3D,"2 Cavendish Pl, London W1B 3DE, Storbritannien",+442079737550,"Skønhedssalon, Massage spa, Massør, Spa",4.6,
The Langdon Clinic,https://www.langdonclinic.com/,"98 Crawford St, London W1H 2HL, Storbritannien",+442071009891,Medicinsk spa,5,
Dr Joney De Souza,http://www.drjoneydesouza.com/,"49 Blandford St, London W1U 7HH, Storbritannien",+442070430748,"Medicinsk spa, Hudplejeklinik",4.9,
Chi Yu Wellness Centre,http://www.chi-yu.co.uk/,"36 George St, London W1U 7DR, Storbritannien",+442074860304,"Wellnesscenter, Akupunkturklinik, Aromaterapi, Massør, Zoneterapeut, Reikiterapeut, Thaimassør",4.8,
Refresh and Spa,https://www.refreshandspa.co.uk/,"Ground Floor, 104 Seymour Pl, London W1H 1NG, Storbritannien",+442072587424,"Massør, Massage spa, Hårvoksning",4.6,
Avicenna Aesthetics,https://avicennawellbeing.com/,"30 b, Nottingham Pl, London W1U 5NP, Storbritannien",+442079353057,"Medicinsk spa, Laser-hårfjerning, Hudplejeklinik, Wellnesscenter",4.9,
Regents Park Aesthetics,https://www.regentsparkaesthetics.co.uk/?utm_source=GMBlisting&utm_medium=organic,"19 Wimpole St, London W1G 8GE, Storbritannien",+442075804813,"Medicinsk spa, Kosmetikindustri, Ansigtsbehandling, Hudplejeklinik",4.7,
By Narjis Clinic,http://www.bynarjis.com/,"17 Thayer St, London W1U 3JX, Storbritannien",+447888687194,"Medicinsk spa, Hudplejeklinik",4.9,
Danugur Marylebone,https://widget.treatwell.co.uk/place/511809/menu/,"Inside Light Centre Marylebone, 10 Portman Square, London W1H 6AZ, Storbritannien",+447552827154,Medicinsk spa,,
Skin Lab Medispa - Marylebone,http://skinlabmedispa.co.uk/?utm_source=google&utm_medium=wix_google_business_profile&utm_campaign=3671584563679723166,"Unit 4, Light Centre Marylebone, 10 Portman Square, London W1H 6AZ, Vương quốc Anh",+442034572046,Cơ sở chăm sóc da,5,
DrMediSpa,http://www.drmedispa.com/,"59 Chiltern St, London W1U 6NF, Vương quốc Anh",+442084180362,"Cơ sở chăm sóc da, Phòng khám phẫu thuật tạo hình",4.8,
Dr Joney De Souza,http://www.drjoneydesouza.com/,"49 Blandford St, London W1U 7HH, Vương quốc Anh",+442070430748,"Spa y tế, Cơ sở chăm sóc da",4.9,
GOOD,,"32 Devonshire Pl, London W1G 6JL, Vương quốc Anh",+442071176776,"Spa y tế, Bác sĩ da liễu",4.9,
Dr Jane Leonard,https://www.drjaneleonard.co.uk/,"1 Orchard St, London W1H 6HJ, Vương quốc Anh",+447777782294,Spa y tế,4.9,
Avicenna Aesthetics,https://avicennawellbeing.com/,"30 b, Nottingham Pl, London W1U 5NP, Vương quốc Anh",+442079353057,"Spa y tế, Dịch vụ tẩy lông bằng la-de, Cơ sở chăm sóc da, Trung tâm chăm sóc sức khỏe",4.9,
Hydrafacial LDN Flagship,https://hydrafacial.co.uk/,"10 Portman Square, London W1H 6AZ, Vương quốc Anh",,"Cơ sở chăm sóc da, Thẩm mỹ viện",4.9,
Beauvia Clinic,http://www.beauvia.clinic/,"2nd Floor, 54 Welbeck St, London W1G 9XS, Vương quốc Anh",+442030841877,"Spa y tế, Thẩm mỹ viện, Công nghiệp mỹ phẩm, Dịch vụ tẩy lông bằng la-de, Cơ sở chăm sóc da, Dịch vụ giảm cân",4.7,
Regents Park Aesthetics,https://www.regentsparkaesthetics.co.uk/?utm_source=GMBlisting&utm_medium=organic,"19 Wimpole St, London W1G 8GE, Vương quốc Anh",+442075804813,"Spa y tế, Công nghiệp mỹ phẩm, Spa mặt, Cơ sở chăm sóc da",4.7,
Waldor Clinic,https://waldorclinic.com/,"35 Great Portland St, London W1W 8QQ, Vương quốc Anh",+447464745114,"Spa y tế, Spa mặt, Phòng khám, Cơ sở chăm sóc da, Dịch vụ xóa hình xăm",4.9,
The Langdon Clinic,https://www.langdonclinic.com/,"98 Crawford St, London W1H 2HL, Vương quốc Anh",+442071009891,Spa y tế,5,
By Narjis Clinic,http://www.bynarjis.com/,"17 Thayer St, London W1U 3JX, Vương quốc Anh",+447888687194,"Spa y tế, Cơ sở chăm sóc da",4.9,
The Beauty Script,https://thebeautyscript.co.uk/,"UNTIL, 1 Orchard St, London W1H 6HJ, Vương quốc Anh",+447312173128,"Spa y tế, Công nghiệp mỹ phẩm, Spa mặt, Phòng khám, Cơ sở chăm sóc da",5,
Derma Lab Clinic at Shadi,https://www.dermalabclinic.co.uk/,"3 Portman Square, London W1H 6LB, Vương quốc Anh",+447990199658,Cơ sở chăm sóc da,5,
Koia,https://www.koia.london/,"32-34 Notting Hill Gate, London W11 3HX, Vương quốc Anh",+442072298686,"Spa, Spa mặt, Spa mát xa, Bác sĩ nắn xương, Nhân viên trị liệu mát-xa thể thao",4.9,
The Well Clinic,https://thewell-clinic.com/,"8-9 Lambton Pl, London W11 2SH, Vương quốc Anh",+442072212248,"Spa y tế, Thẩm mỹ viện, Bác sĩ y học tổng thể, Dịch vụ tẩy lông bằng la-de, Bác sĩ trị liệu xoa bóp, Cơ sở chăm sóc da, Tiệm chăm sóc móng, Bác sĩ nắn xương, Dịch vụ giảm cân, Trung tâm chăm sóc sức khỏe",4.8,
"Cloud Twelve Wellness, Spa and Kid's Club",https://www.cloudtwelve.co.uk/,"2-5 Colville Mews, London W11 2DA, Vương quốc Anh",+442033011012,"Câu lạc bộ spa và sức khỏe, Câu lạc bộ trẻ em, Spa mặt, Spa mát xa, Bác sĩ chuyên về thiên nhiên liệu pháp, Thợ làm tóc, Trung tâm chăm sóc sức khỏe",4.9,
Apogii Clinic (Get A Drip),https://www.apogiiclinic.co.uk/?utm_source=GMB&utm_medium=GMB&utm_campaign=website,"105 Westbourne Grove, London W2 4UW, Vương quốc Anh",+442072298580,"Trung tâm chăm sóc sức khỏe, Thẩm mỹ viện, Spa sức khỏe, Dịch vụ liệu pháp IV, Spa mát xa, Cơ sở chăm sóc da",4.8,
Ayanna Spa,http://www.ayannaspa.co.uk/,"146 Holland Park Ave, London W11 4UE, Vương quốc Anh",+442079987872,"Thẩm mỹ viện, Spa mặt, Cửa hàng chăm sóc sức khỏe và làm đẹp, Spa mát xa, Tiệm chăm sóc móng, Cơ sở chăm sóc da, Dịch vụ tẩy lông bằng sáp",4.8,
Skinglow Clinic,http://www.skinglowclinic.co.uk/,"216 Kensington Park Rd, London W11 1NR, Vương quốc Anh",+442073139641,"Spa y tế, Thẩm mỹ viện, Spa mặt, Cơ sở chăm sóc da",5,
Spa Experience Kensington,https://www.spaexperience.org.uk/locations/kensington?utm_source=google&utm_medium=organic&utm_campaign=google_my_business,"Kensington Leisure Centre, Bomore Rd, London W10 6EX, Vương quốc Anh",+442037938220,"Spa, Spa ban ngày, Bác sĩ trị liệu xoa bóp, Câu lạc bộ spa và sức khỏe",3.8,
Skin Matters,https://skin-matters.co.uk/,"Skin-Matters, 119B Portland Rd, London W11 4LN, Vương quốc Anh",+442077926999,"Cơ sở chăm sóc da, Spa mặt",5,
I. Empiress Massage & Contour Spa,https://iempiressmassagencontourspa.setmore.com/bookappointment,"Westway Portobello Fitness Club, 3-5, Thorpe Cl, London W10 5XL, Vương quốc Anh",,"Thẩm mỹ viện, Cửa hàng chăm sóc sức khỏe và làm đẹp, Bác sĩ trị liệu xoa bóp, Dịch vụ giảm cân, Trung tâm chăm sóc sức khỏe",4.8,
Mell Aesthetics Brazilian Clinic in Holland Park,https://mellaesthetics.mytreatwell.co.uk/,"3 Bramley Rd, London W10 6SZ, Vương quốc Anh",+447475252607,"Spa y tế, Công nghiệp mỹ phẩm, Spa mặt, Cơ sở chăm sóc da",5,
Rindie Ras Face Massage,http://www.rindieras.co.uk/,"London W11 3HT, Vương quốc Anh",+447932852603,Spa mặt,5,
Recharge Rooms,,"8 Pembridge Gardens, London W2 4DU, Vương quốc Anh",+447719119050,Trung tâm chăm sóc sức khỏe,5,
Injectual,http://www.injectual.com/,"59 Westbourne Grove, Greater, London W2 4UA, Vương quốc Anh",+442039519115,Spa y tế,5,
The Therapy Room London,http://www.thetherapyroomlondon.com/,"Bramley PharmaClinics, 132 Bramley Rd, London W10 6SU, Vương quốc Anh",+447747020941,"Spa mát xa, Thẩm mỹ viện, Bác sĩ trị liệu xoa bóp, Dịch vụ tẩy lông bằng sáp",4.8,
Re:Nu Dental & Medispa,https://renudentalmedispa.com/?utm_source=local&utm_medium=organic&utm_content=gmb,"20 Chepstow Rd, London W2 5BD, Vương quốc Anh",+442081674185,"Spa y tế, Nha sĩ, Phòng khám nha khoa, Bác sĩ chỉnh răng, Cơ sở chăm sóc da, Dịch vụ tẩy trắng răng",4.8,
Dias Clinic,https://widget.treatwell.co.uk/place/414314/menu/,"3B Wellington Ter, London W2 4LW, Vương quốc Anh",+447862497077,"Spa, Chuyên gia làm đẹp, Nhà cung cấp sản phẩm làm đẹp, Phòng khám chuyên khoa, Nhân viên trị liệu mát-xa thể thao",4.9,
THE LUMI SPA,https://thelumispa.co.uk/,"19-21 Great Marlborough St, London W1F 7HL، المملكة المتحدة",+442046100959,منتجع صحي,4.5,
Bespoke Medispa,https://newukdetails.top/details/bespoke-medispa-ChIJpeA,"11 Greek St, London W1D 4DJ، المملكة المتحدة",+447912102070,"منتجع طبي, المنتجع الصحي, مركز الحفاظ على الصحة",4.8,
Soholistic Spa,https://www.firmdalehotels.com/hotels/london/ham-yard-hotel/soholistic-spa/,"Hotel, One Ham Yard, London W1D 7DT، المملكة المتحدة",+442036421035,منتجع صحي,4.8,
Effect Doctors - Soho,https://effectdoctors.com/our-locations/soho/?utm_source=gbp&utm_medium=organic&utm_campaign=soho,"11 Greek St, London W1D 4DJ، المملكة المتحدة",+442073057608,"منتجع طبي, خدمة فحص الدم, طبيب, مستشار صحي, المنتجع الصحي, عيادة طبية, خدمة فقدان الوزن, مركز الحفاظ على الصحة",4.9,
AWAY Spa London,https://www.awayspalondon.com/,"W, 10 Wardour St, London W1D 6QF، المملكة المتحدة",+442077581071,"منتجع صحي, أخصائي معالجة بالتدليك",4.3,
Grown Alchemist Retail Store + Wellness Services,https://grownalchemist.com/uk/,"35 Beak St, Carnaby, London W1F 9SX، المملكة المتحدة",+442045915190,"بخار وجه, مساج وسبا, منتجع صحي",5,
Simply Relax Spa,http://www.simplyrelaxspa.com/,"22A Brewer St, London W1F 0SL، المملكة المتحدة",+442074942277,"مساج وسبا, أخصائي معالجة بالتدليك, تدريب تأمل",3.7,
GG Beauty Massage Soho,https://lotus-blossom-haven.lovable.app/,"16a Frith St, London W1D 4RF، المملكة المتحدة",+447938998386,"أخصائي معالجة بالتدليك, صالون تدليك القدم, Massage parlor, مساج وسبا, أخصائي علم منعكسات, أخصائي مساج رياضي, معالج تدليك تايلاندي",4.2,
7 Bali Spa,https://7balispa.co.uk/,"11-12 Newman St, London W1T 1PB، المملكة المتحدة",+442045475467,منتجع صحي,4.8,
Premier Laser & Skin Soho,https://londonpremierlaser.co.uk/?utm_source=googlemybusiness&utm_medium=organic&utm_campaign=google+my+business+-+soho,"177 Wardour St, London W1F 8WX، المملكة المتحدة",+442072879210,"خدمة إزالة الشعر الزائد بالليزر, صالون تجميل, بخار وجه, منتجع طبي, عيادة للعناية بالبشرة, خدمة إزالة الوشم",4.5,
Margaret Dabbs London Sole Spa at Liberty,https://www.margaretdabbs.co.uk/margaret-dabbs-london-sole-spa-at-liberty-london/,"3rd Floor, Liberty, Great Marlborough St, Carnaby, London W1B 5AH، المملكة المتحدة",+442074944492,"طبيب مختصّ في أمراض القدم, صالون عناية بالأظافر",4.7,
Dr. David Jack,https://drdavidjack.com/pages/dr-david-jack-liberty,"Basement Floor, Regent St., Carnaby, London W1B 5AH، المملكة المتحدة",+442075896309,عيادة للعناية بالبشرة,5,
Face Clinic London,https://facecliniclondon.com/,"7 Silver Pl, London W1F 0JT، المملكة المتحدة",+442078516624,"منتجع طبي, مركز طبي, عيادة للعناية بالبشرة",4.7,
Beauty & Melody Spa Piccadilly,https://www.beautyandmelody.co.uk/,"65-73 Shaftesbury Avenue within Piccadilly London West End Hotel, London W1D 6EX، المملكة المتحدة",+442071128949,"منتجع صحي, منتجع صحي نهاري, بخار وجه, ساونا مثلي الجنس, المنتجع الصحي, مساج وسبا, أخصائي معالجة بالتدليك, حمام بخار, منتجع ونادي صحي",3.9,
Natural Wellness,,"29 Peter St, London W1F 0AN، المملكة المتحدة",+442074944988,"Massage parlor, عيادة إبر صينية, متجر الطب الصيني",4,
Rene Clinic,https://reneclinic.uk/,"9 Warwick St, London W1B 5LZ، المملكة المتحدة",+442034787000,"عيادة للعناية بالبشرة, صالون تجميل, صناعة مستحضرات التجميل, بخار وجه",4.8,
Akasha,http://www.hotelcaferoyal.com/wellness,"Hotel, Café Royal, 68 Regent St., London W1B 4DY، المملكة المتحدة",+442074063360,"منتجع ونادي صحي, غرفة لياقة, مركز الحفاظ على الصحة",4.5,
SKINWORK,http://www.skinwork.com/,"24 Peter St, London W1F 0HE، المملكة المتحدة",+447935541024,"عيادة للعناية بالبشرة, صالون تجميل, متجر مستحضرات الصحة والتجميل",4.3,
Skin Precision,https://linktr.ee/sknprecision,"1 Hanway Pl, London W1T 1HA، المملكة المتحدة",+447311267591,"منتجع طبي, صالون تجميل, بخار وجه, متجر مستحضرات الصحة والتجميل, عيادة للعناية بالبشرة, خدمة فقدان الوزن, مركز الحفاظ على الصحة",4.5,
