name,website,address,phone,category,rating,reviews_count
Re:treat Medispa,https://retreatlondon.co.uk/?utm_source=google&utm_medium=maps,"126 Upper Richmond Rd, London SW15 2SP, Vương quốc Anh",+442087885619,"Spa mặt, Thẩm mỹ viện, Bác sĩ trị liệu xoa bóp, Spa y tế, Cơ sở chăm sóc da",4.9,
Nattawan Thai Spa,http://www.nattawanthaispa.co.uk/,"2 Upper Richmond Rd, London SW15 2SD, Vương quốc Anh",+442088710918,Bác sĩ trị liệu xoa bóp,4.9,
The Dental Spa,https://www.dentalspaputney.co.uk/,"201 Lower Richmond Rd., London SW15 1HJ, Vương quốc Anh",+442087857105,"Nha sĩ, Phòng khám nha khoa, Chuyên viên vệ sinh nha khoa",5,
The Magnolia Room,http://www.themagnoliaroom.co.uk/,"32 Lower Richmond Rd., London SW15 1JP, Vương quốc Anh",+442087851891,"Thẩm mỹ viện, Spa mặt, Dịch vụ tẩy lông bằng la-de, Bác sĩ trị liệu xoa bóp, Spa, Cửa hàng tắm nắng nhân tạo, Dịch vụ tẩy lông bằng sáp",4.9,
True Thai Massage and Spa Putney,http://www.truethai.co.uk/,"116 Upper Richmond Rd, London SW15 2SP, Vương quốc Anh",+447538599915,Bác sĩ trị liệu xoa bóp,4.9,
The Forest Beauty & Spa,https://www.theforestbeauty.co.uk/,"226a Upper Richmond Rd, London SW15 6TG, Vương quốc Anh",+447487894514,Thẩm mỹ viện,5,
The Massage Company,https://putney.massagecompany.co.uk/,"1st Floor, Putney Exchange, Putney High St, London SW15 1TW, Vương quốc Anh",+442045418000,"Spa, Spa mát xa, Bác sĩ trị liệu xoa bóp, Nhân viên trị liệu mát-xa thể thao, Trung tâm chăm sóc sức khỏe",4.6,
Laser Clinics UK - Putney,https://www.laserclinics.co.uk/skin-care-clinics/putney/?utm_source=google&utm_medium=organic&utm_campaign=Google%20My%20Business%20Page&utm_content=Putney&utm_term=plcid_6276241146535036778,"151 Putney High St, London SW15 1SU, Vương quốc Anh",+442037459675,"Dịch vụ tẩy lông bằng la-de, Thẩm mỹ viện, Công nghiệp mỹ phẩm, Spa mặt, Spa y tế, Cơ sở chăm sóc da",4.5,
Juniper,http://thejuniperhour.com/,"Located in Ethel Nails & Beauty, 223 Upper Richmond Rd, London SW15 6SQ, Vương quốc Anh",+447860158557,Spa mặt,5,
Hatt Thip Thai Spa & Massage - London,https://hattthipspa.com/,"199b Lower Richmond Rd., London SW15 1HJ, Vương quốc Anh",+447706157213,"Spa mát xa, Phòng mát-xa chân, Massage parlor, Bác sĩ trị liệu xoa bóp, Nhân viên trị liệu mát-xa kiểu Thái",4.8,
Wanida Thai Spa Massage Putney,http://www.wanidaspa.com/,"22 Lower Richmond Rd., London SW15 1JP, Vương quốc Anh",+447778099805,"Bác sĩ trị liệu xoa bóp, Nhân viên trị liệu mát-xa kiểu Thái",4.6,
Living Health Care Putney Massage,https://livinghealthcare.wixsite.com/fulham-living-health,"57B Fulham High St, London SW6 3JJ, Vương quốc Anh",+442076106001,"Massage parlor, Chuyên gia châm cứu, Bác sĩ trị liệu xoa bóp",4.7,
Aromathera,,"13 Evenwood Cl, London SW15 2DA, Vương quốc Anh",,Spa y tế,5,
MJ Medispa and Hair Salon,http://mjmedispa.co.uk/,"290A Upper Richmond Rd, London SW15 6TH, Vương quốc Anh",+442079989810,Cơ sở chăm sóc da,4.6,
Premier Laser & Skin Clinic,https://londonpremierlaser.co.uk/?utm_source=googlemybusiness&utm_medium=organic&utm_campaign=google+my+business+-+clapham,"14 The Pavement, London SW4 0HY, United Kingdom",+442074980188,"Laser hair removal service, Skin care clinic, Tattoo removal service",4.7,
sk:n London Clapham Lavender Hill,https://www.sknclinics.co.uk/clinics/london/clapham-lavender-hill,"263 Lavender Hill, London SW11 1JD, United Kingdom",+443330141666,"Laser hair removal service, Beauty Parlour, Dermatologist, Skin care clinic",4.4,
Skin Philosophy,http://www.skinphilosophy.co.uk/,"Unit 6H, Voltaire Rd, London SW4 6DH, United Kingdom",+442083929411,"Skin care clinic, Facial spa, Laser hair removal service",4.9,
Laser Clinics UK - Clapham Junction,https://www.laserclinics.co.uk/skin-care-clinics/clapham-junction/?utm_source=google&utm_medium=organic&utm_campaign=Google%20My%20Business%20Page&utm_content=Clapham%20Junction&utm_term=plcid_5443848287223419935,"59 St John's Rd, London SW11 1QW, United Kingdom",+442034750661,"Laser hair removal service, Beauty Parlour, Cosmetics industry, Facial spa, Medical spa, Skin care clinic",4.6,
Total Body Care,http://www.totalbodycare.co.uk/,"31 Clapham High St, London SW4 7TR, United Kingdom",+442030922766,"Skin care clinic, Beauty product supplier, Cosmetics store, Laser hair removal service, Nutritionist, Travel clinic, Waxing hair removal service, Weight loss service, Wellness center",4.7,
Clapham Skin Clinic,https://www.claphamskinclinic.co.uk/,"521-525 Battersea Park Rd, London SW11 3BN, United Kingdom",+447484083214,Skin care clinic,3,
Rescued by Aesthetics,http://www.rescuedbyaesthetics.com/?utm_source=google&utm_medium=wix_google_business_profile&utm_campaign=1146892448753492994,"88, Unit 17 Clapham Park Rd, Abbeville Mews, London SW4 7BX, United Kingdom",+447946716757,Beauty Parlour,4.9,
Thérapie Clinic - Clapham Junction,https://therapieclinic.com/locations/clapham-junction?utm_source=google&utm_medium=organic&utm_campaign=gmb&utm_content=clapham-junction,"C63, 61 St John's Rd, London SW11 1QX, United Kingdom",+442037017977,Laser hair removal service,4.6,
Skin Emporium,https://skinemporium.co.uk/,"181 Northcote Rd, London SW11 6QF, United Kingdom",+442086171121,Skin care clinic,4.9,
Thérapie Clinic - Clapham South,https://therapieclinic.com/locations/clapham-south?utm_source=google&utm_medium=organic&utm_campaign=gmb&utm_content=clapham-south,"34 Abbeville Rd, Clapham South, London SW4 9NG, United Kingdom",+442038563883,Laser hair removal service,4.8,
Mojo Aesthetics,https://mojo-aesthetics.co.uk/,"149a Clapham High St, London SW4 7SS, United Kingdom",+447414775017,"Skin care clinic, Laser hair removal service, Massage therapist, Weight loss service",5,
The Bellissima Clinic,http://www.bellissimatherapies.co.uk/,"5-6, Westbury Parade, Clapham South, London SW12 9DZ, United Kingdom",+442036741663,"Beauty Parlour, Ear piercing service, Massage therapist, Skin care clinic, Hairdresser, Waxing hair removal service",4.5,
SW11 Medical Clinic - Clapham,https://sw11clinic-clapham.co.uk/,"45 Lavender Hill, London SW11 5QW, United Kingdom",+442072235114,"Medical clinic, Medical Center",4.5,
Hammam Spa London,http://www.hammamspa.london/,"92 Forest Hill Rd, London SE22 0RS، المملكة المتحدة",+442034897474,منتجع صحي نهاري,4.1,
Aesthetics by Lauren Turner,http://www.aestheticsbylaurenturner.com/,"133 Lordship Ln, London SE22 8HX، المملكة المتحدة",+442082263800,"منتجع طبي, صالون تجميل, صناعة مستحضرات التجميل, عيادة طبية, خدمة فقدان الوزن",4.9,
HB Therapy East Dulwich,https://hb-therapy.co.uk/hb-therapy-beauty-salon-east-dulwich/,"8 Melbourne Grove, HBTherapy SE22 8QZ، المملكة المتحدة",+442086933773,"صالون تجميل, منتجع صحي نهاري, مساج وسبا, صالون عناية بالأظافر, عيادة للعناية بالبشرة, منتجع صحي",4.8,
Glowing Essence Clinic,https://www.glowingessenceclinic.com/,"352 Lordship Ln, London SE22 8LZ، المملكة المتحدة",+447960878378,"منتجع طبي, صالون تجميل, صناعة مستحضرات التجميل, طبيب أمراض جلدية, بخار وجه, متجر مستحضرات الصحة والتجميل, عيادة للعناية بالبشرة",5,
Mothers Inc,https://mothersinc.co.uk/,"124 Forest Hill Rd, London SE22 0RS، المملكة المتحدة",+442086934033,"مساج وسبا, صالون تجميل, بخار وجه, صالون عناية بالأظافر, أخصائي علم منعكسات, خدمة إزالة الشعر الزائد بالشمع",4.8,
Gaby Leon Skin and Laser - Dulwich,http://gabyleonaestheticsskinandlaserclinic.gettimely.com/,"16 Melbourne Grove, London SE22 8QZ، المملكة المتحدة",+442080920096,"خدمة إزالة الشعر الزائد بالليزر, صالون تجميل, بخار وجه",5,
Dulwich Therapy Rooms,https://www.dulwichtherapyrooms.co.uk/,"Integrated Health Clinic, 47 Lordship Ln, London SE22 8EP، المملكة المتحدة",+442082994232,"عيادة طبية, عيادة إبر صينية, مستشار, بخار وجه, أخصائي معالجة بالتدليك, أخصائي تجبير عظام, أخصائي علاج طبيعي, أخصائي علم نفس, أخصائي علم منعكسات, أخصائي مساج رياضي",4.9,
PERSONAL BEST AESTHETICS LTD,https://www.pbaesthetics.co.uk/,"Personal Best Aesthetics- Quetzal Studio, 125 Dulwich Rd, London SE24 0NG، المملكة المتحدة",+447858315443,منتجع طبي,5,
Lesley Leale-Green Skin & Laser Clinic,http://www.lesleylealegreen.com/,"70 Dulwich Village, London SE21 7AJ، المملكة المتحدة",+442082992906,"صالون تجميل, خدمة إزالة الشعر الزائد بالليزر, عيادة للعناية بالبشرة",4.9,
CORE Soft Tissue Therapy & Massage,https://coredulwich.co.uk/,"9 Upland Rd, London SE22 9EE، المملكة المتحدة",+447879654595,"أخصائي معالجة بالتدليك, عيادة إبر صينية, معالج التدليك الليمفاوي, مساج وسبا, أخصائي علاج طبيعي, عيادة علاج طبيعي, مركز رعاية الحمل, أخصائي علم منعكسات, أخصائي مساج رياضي, معالج تدليك تايلاندي",5,
Wellness & Laser Centre - Crystal Palace,http://www.wellnesslasercentre.com/,"64 Church Rd, London SE19 2EZ، المملكة المتحدة",+442036338522,"منتجع صحي نهاري, بخار وجه, خدمة إزالة الشعر الزائد بالليزر, مساج وسبا, حمام الساونا العمومي, عيادة للعناية بالبشرة, خدمة إزالة الوشم, خدمة إزالة الشعر الزائد بالشمع, خدمة فقدان الوزن",4.5,
S.Spa London,https://www.sliquespa.net/?utm_source=yell&utm_medium=referral&utm_campaign=yell,"95 Streatham Hill, London SW2 4UD، المملكة المتحدة",+442086747814,"منتجع صحي نهاري, صالون تجميل, بخار وجه, مساج وسبا, صالون عناية بالأظافر, حمام بخار, عيادة للعناية بالبشرة, خدمة إزالة الشعر الزائد بالشمع",4.7,
Amari Head Spa Penge,https://www.amariheadspa.co.uk/,"37 High St, London SE20 7HJ، المملكة المتحدة",+442045688420,منتجع صحي نهاري,5,
Holistic wellness practice,https://www.fresha.com/a/healing-with-hands-london-59-east-dulwich-road-bxasw7zp/booking?allOffer=true&pId=337047,"Goose Green Clinic, 59 E Dulwich Rd, London SE22 9AP، المملكة المتحدة",+447538189047,منتجع طبي,5,
The Beauty Haven,https://www.thebeautyhavendulwich.co.uk/,"52 Amott Rd, London SE15 4JD، المملكة المتحدة",+442072775917,"صالون تجميل, أخصائي معالجة بالتدليك",4.7,
Sawm Health & Beauty,http://sawmhealthandbeauty.com/,"491 Lordship Ln, London SE22 8JY، المملكة المتحدة",+442086935222,صالون تجميل,4.9,
Thai Miracle Health & Beauty,http://www.thaimiracle.co.uk/,"Singhara (Health & Beauty), 391 Lordship Ln, London SE22 8JN، المملكة المتحدة",,"معالج تدليك تايلاندي, صالون تجميل",4.5,
London Cheltenham Aesthetics,https://www.lc-aesthetics.co.uk/,"20, 22 Lordship Ln, London SE22 8HN، المملكة المتحدة",,"منتجع طبي, عيادة للعناية بالبشرة",5,
Emma Wilson Urban Spa,https://www.emmawilsonurbanspa.co.uk/#,"166 Norwood Rd, Norwood, London SE27 9AZ، المملكة المتحدة",+442086748249,"صالون تجميل, بخار وجه, أخصائي معالجة بالتدليك, صالون عناية بالأظافر",4.9,
Dr Boo Beauty Emporium,http://www.drboo.co.uk/,"22 N Cross Rd, London SE22 9EU، المملكة المتحدة",+442086934823,صالون تجميل,4.7,
Rooftop Saunas Brixton,https://rooftopsaunas.com/locations/brixton/,"International House, 6 Canterbury Cres, London SW9 7QD, United Kingdom",+447352310450,"Sauna, Fitness center, Wellness center",4.5,
Blocspa Brixton,https://www.blocfit.co.uk/blocspa,"Arch 267, 241 Coldharbour Ln, Blocfit SW9 8RR, United Kingdom",+442077384585,Sauna club,5,
Dhara Araujo Beauty & Aesthetics Clinic,https://widget.treatwell.co.uk/place/506433/menu/,"409-411 Brixton Rd, SW97DG SW9 7DG, United Kingdom",+447727144198,"Beautician, Beauty salon, Facial spa, Hair removal service, Laser hair removal service, Massage therapist, Nail salon, Sports massage therapist",5,
BeautyPac Beauty & Massage Salon,http://www.beautypac.co.uk/,"166 Stockwell Rd, London SW9 9TQ, United Kingdom",+447903041540,"Beauty salon, Massage spa, Nail salon, Spa, Tanning salon, Waxing hair removal service",4.6,
One Aesthetics Clinic,https://oneaestheticsclinic.com/?utm_source=Google&utm_medium=Organic&utm_campaign=GBP-listing,"62 Coldharbour Ln, London SE5 9PU, United Kingdom",+442039870044,"Medical spa, Dermatologist, Medical clinic, Skin care clinic",5,
Thai Sense Spa,http://www.thaisensespa.co.uk/,"8, Ascot Parade, Clapham Park Rd, London SW4 7EY, United Kingdom",+442074987002,Thai massage therapist,4.7,
The Beauty Lounge,https://widget.treatwell.co.uk/place/410633/menu/,"63A, 49 Effra Rd, London SW2 1BZ, United Kingdom",,"Beauty salon, Facial spa, Hair extension technician, Massage spa, Massage therapist, Skin care clinic",4.8,
Community Sauna Baths - Camberwell,https://www.community-sauna.co.uk/locations/camberwell,"Ruskin Pk, Denmark Hill, London SE5 8EL, United Kingdom",,Sauna,4.6,
Hammam Spa London,http://www.hammamspa.london/,"92 Forest Hill Rd, London SE22 0RS, United Kingdom",+442034897474,Day spa,4.1,
SH Massage Therapy Rooms,https://shmassagetherapyrooms.mytreatwell.co.uk/,"The Link Business Centre, 49 Effra Rd, London SW2 1BZ, United Kingdom",+447784078212,"Massage therapist, Aromatherapy service, Sports massage therapist",5,
Secret Spa,https://secretspa.co.uk/,"Head Office, Lincoln house, London SW9 6DE, United Kingdom",+442070960506,"Beauty salon, Beautician, Hair removal service, Make-up artist, Massage therapist, Nail salon, Tanning salon, Hairdresser",4.7,
Victoria Beauty & Aesthetics,,"214 Coldharbour Ln, London SW9 8SA, United Kingdom",,Beauty salon,4.9,
Soho Aesthetics,,"Unit S/31, Pop Brixton, 49 Brixton Station Rd, London SW9 8PQ, United Kingdom",+447506180799,Skin care clinic,,
Herou aesthetics Lab,https://www.herouaestheticslab.co.uk/,"236B Railton Rd, London SE24 0JT, United Kingdom",+442045399638,Beautician,5,
Reshape Aesthetics,http://www.reshapeaesthetics.co.uk/,"207 Camberwell Rd, London SE5 0HG, United Kingdom",+442038753746,"Cosmetics industry, Health and beauty shop",4.9,
Macsoflondon,,"C/o, Pavilion Pharmacy - Clinic, Piano house, 9, 1 Brighton Terrace, London SW9 8DJ, United Kingdom",+447776330508,Skin care clinic,5,
White Swan Aesthetics,https://www.whiteswanaesthetics.co.uk/clapham-clinic,"Zaku Studios, 151 Lavender Hill, London SW11 5QJ, Royaume-Uni",+443335777926,Clinique dermatologique,4.8,
Rescued by Aesthetics,http://www.rescuedbyaesthetics.com/?utm_source=google&utm_medium=wix_google_business_profile&utm_campaign=1146892448753492994,"88, Unit 17 Clapham Park Rd, Abbeville Mews, London SW4 7BX, Royaume-Uni",+447946716757,Institut de beauté,4.9,
Mojo Aesthetics,https://mojo-aesthetics.co.uk/,"149a Clapham High St, London SW4 7SS, Royaume-Uni",+447414775017,"Clinique dermatologique, Centre d'épilation laser, Massothérapeute, Centre d'amincissement",5,
Skin Emporium,https://skinemporium.co.uk/,"181 Northcote Rd, London SW11 6QF, Royaume-Uni",+442086171121,Clinique dermatologique,4.9,
Facefull Aesthetics,https://www.facefullaesthetics.co.uk/,"Facefull Aesthetics, 168 Acre Ln, London SW2 5UL, Royaume-Uni",+447359888975,"Clinique dermatologique, Groupe médical",5,
Dr. Alessio Mocci - Aesthetic Medicine,,"45 Lavender Hill, London SW11 5QW, Royaume-Uni",+442072235114,Médecin,5,
Thérapie Clinic - Clapham South,https://therapieclinic.com/locations/clapham-south?utm_source=google&utm_medium=organic&utm_campaign=gmb&utm_content=clapham-south,"34 Abbeville Rd, Clapham South, London SW4 9NG, Royaume-Uni",+442038563883,Centre d'épilation laser,4.8,
Dr Kate BB Aesthetics,http://www.drkatebb.com/,"The Cosmetic Dental Gallery Battersea, 20 Patcham Terrace, Nine Elms, London SW8 4EY, Royaume-Uni",+447774759867,Clinique dermatologique,5,
sk:n London Clapham Lavender Hill,https://www.sknclinics.co.uk/clinics/london/clapham-lavender-hill,"263 Lavender Hill, London SW11 1JD, Royaume-Uni",+443330141666,"Centre d'épilation laser, Institut de beauté, Dermatologue, Clinique dermatologique",4.4,
Total Body Care,http://www.totalbodycare.co.uk/,"31 Clapham High St, London SW4 7TR, Royaume-Uni",+442030922766,"Clinique dermatologique, Fournisseur de produits de beauté, Magasin de cosmétiques, Centre d'épilation laser, Nutritionniste, Centre de vaccinations internationales, Service d'épilation à la cire, Centre d'amincissement, Centre de bien-être",4.7,
SW11 Medical Clinic - Clapham,https://sw11clinic-clapham.co.uk/,"45 Lavender Hill, London SW11 5QW, Royaume-Uni",+442072235114,"Clinique, Centre médical",4.5,
THE CURATED CLINIC,https://thecuratedclinic.com/,"75 Broughton St, London SW8 3QB, Royaume-Uni",+447725888974,"Spa médical, Institut de beauté, Industrie cosmétique, Médecin, Services médicaux de proximité, Clinique dermatologique, Centre de bien-être",5,
Daryl's Aesthetics,https://www.darylsaesthetics.com/,"809 Wandsworth Rd, London SW8 3JH, Royaume-Uni",+447941380734,Clinique dermatologique,5,
Facefull Aesthetics,https://www.facefullaesthetics.co.uk/,"Facefull Aesthetics, 168 Acre Ln, London SW2 5UL, Reino Unido",+447359888975,"Clínica dermatológica, Grupo médico",5,
Victoria Beauty & Aesthetics,,"214 Coldharbour Ln, London SW9 8SA, Reino Unido",,Centro de estética,4.9,
Herou Aesthetics Lab,https://www.herouaestheticslab.co.uk/,"348 Coldharbour Ln, London SW9 8QH, Reino Unido",+442045399638,Esteticista,4.8,
BRIXTON: MEDICAL & AESTHETICS,https://brixtonaesthetics.co.uk/,"516 Brixton Rd, London SW9 8EN, Reino Unido",+442037001013,Spa terapéutico,5,
Fierce Face Skin Clinic,https://www.fierce-face.com/,"Unit 7, Abbeville Mews, 88 Clapham Park Rd, London SW4 7BX, Reino Unido",+442080449247,Clínica dermatológica,5,
Dhara Araujo Beauty & Aesthetics Clinic,https://widget.treatwell.co.uk/place/506433/menu/,"409-411 Brixton Rd, SW97DG SW9 7DG, Reino Unido",+447727144198,"Centro de depilación láser, Centro de estética, Eyebrow bar, Eyelash salon, Esteticista facial, Servicio de depilación, Esteticista, Masajista, Salón de manicura y pedicura, Masajista deportivo",5,
Skin Philosophy,http://www.skinphilosophy.co.uk/,"Unit 6H, Voltaire Rd, London SW4 6DH, Reino Unido",+442083929411,"Clínica dermatológica, Esteticista facial, Centro de depilación láser",4.9,
Sean White Aesthetics,https://seanwhiteaesthetics.com/,"14, Streatham High Rd, London SW16 1EQ, Reino Unido",+442080504065,Clínica dermatológica,4.8,
Total Body Care,http://www.totalbodycare.co.uk/,"31 Clapham High St, London SW4 7TR, Reino Unido",+442030922766,"Clínica dermatológica, Proveedor de productos de belleza, Tienda de cosméticos, Centro de depilación láser, Nutricionista, Clínica para viajeros, Depilación con cera, Centro de adelgazamiento, Centro de salud y bienestar",4.7,
Cactus Laser Clinic,https://www.cactuslaserclinic.com/,"90 Atlantic Rd, London SW9 8PX, Reino Unido",+442046315757,Centro de depilación láser,5,
Naked Hare Group Ltd,https://www.nakedharegroup.com/,"130 Acre Ln, London SW2 5RJ, Reino Unido",+442073260753,"Centro de estética, Eyebrow bar, Eyelash salon, Clínica dermatológica, Depilación con cera",4.8,
The Beauty Lounge,https://widget.treatwell.co.uk/place/410633/menu/,"63A, 49 Effra Rd, London SW2 1BZ, Reino Unido",,"Centro de estética, Eyebrow bar, Eyelash salon, Esteticista facial, Peluquero especialista en extensiones, Massage spa, Masajista, Clínica dermatológica",4.8,
Brixton Smiles Dental Clinic,https://www.brixtonsmiles.co.uk/?utm_source=google&utm_medium=maps,"411 Coldharbour Ln, London SW9 8LH, Reino Unido",+442039870447,"Dentista, Dentista cosmético, Clínica dental, Higienista dental, Dental implants provider, Ortodoncista, Periodoncista, Prostodoncista",4.8,
Lesley Leale-Green Skin & Laser Clinic,http://www.lesleylealegreen.com/,"70 Dulwich Village, London SE21 7AJ, Reino Unido",+442082992906,"Centro de estética, Centro de depilación láser, Clínica dermatológica",4.9,
Herou aesthetics Lab,https://www.herouaestheticslab.co.uk/,"236B Railton Rd, London SE24 0JT, Reino Unido",+442045399638,Esteticista,5,
BeautyPac Beauty & Massage Salon,http://www.beautypac.co.uk/,"166 Stockwell Rd, London SW9 9TQ, Reino Unido",+447903041540,"Centro de estética, Massage spa, Salón de manicura y pedicura, Spa, Centro de bronceado, Depilación con cera",4.6,
MED Aesthetic Clinic UK,http://medaestheticclinic.co.uk/,"Overton Rd, London SW9 7AP, Vương quốc Anh",+447308438403,Phòng khám chuyên khoa,4.9,
BRIXTON: MEDICAL & AESTHETICS,https://brixtonaesthetics.co.uk/,"516 Brixton Rd, London SW9 8EN, Vương quốc Anh",+442037001013,Spa y tế,5,
Facefull Aesthetics,https://www.facefullaesthetics.co.uk/,"Facefull Aesthetics, 168 Acre Ln, London SW2 5UL, Vương quốc Anh",+447359888975,"Cơ sở chăm sóc da, Nhóm y khoa",5,
Herou Aesthetics Lab,https://www.herouaestheticslab.co.uk/,"348 Coldharbour Ln, London SW9 8QH, Vương quốc Anh",+442045399638,Chuyên gia làm đẹp,4.8,
One Aesthetics Clinic,https://oneaestheticsclinic.com/?utm_source=Google&utm_medium=Organic&utm_campaign=GBP-listing,"62 Coldharbour Ln, London SE5 9PU, Vương quốc Anh",+442039870044,"Spa y tế, Bác sĩ da liễu, Phòng khám, Cơ sở chăm sóc da",5,
PERSONAL BEST AESTHETICS LTD,https://www.pbaesthetics.co.uk/,"Personal Best Aesthetics- Quetzal Studio, 125 Dulwich Rd, London SE24 0NG, Vương quốc Anh",+447858315443,Spa y tế,5,
Victoria Beauty & Aesthetics,,"214 Coldharbour Ln, London SW9 8SA, Vương quốc Anh",,Thẩm mỹ viện,4.9,
Beauti Skin Clinic,https://www.beautiskinclinic.com/,"66A Brixton Rd, London SW9 6BP, Vương quốc Anh",+447780570435,"Cơ sở chăm sóc da, Dịch vụ tẩy lông bằng la-de",5,
Dhara Araujo Beauty & Aesthetics Clinic,https://widget.treatwell.co.uk/place/506433/menu/,"409-411 Brixton Rd, SW97DG SW9 7DG, Vương quốc Anh",+447727144198,"Chuyên gia làm đẹp, Thẩm mỹ viện, Quầy làm lông mày, Tiệm làm mi, Spa mặt, Dịch vụ tẩy lông, Dịch vụ tẩy lông bằng la-de, Bác sĩ trị liệu xoa bóp, Tiệm chăm sóc móng, Nhân viên trị liệu mát-xa thể thao",5,
Keem Medical Aesthetics Clinic,https://keemaesthetics.co.uk/,"20 Bradley Rd, London SW4 8FA, Vương quốc Anh",+447575788375,"Cơ sở chăm sóc da, Dịch vụ xét nghiệm máu, Dịch vụ chứng chỉ y tế, Phòng khám, Điều dưỡng điều trị, Công nghiệp mỹ phẩm",5,
Soho Aesthetics,,"Unit S/31, Pop Brixton, 49 Brixton Station Rd, London SW9 8PQ, Vương quốc Anh",+447506180799,Cơ sở chăm sóc da,,
Rescued by Aesthetics,http://www.rescuedbyaesthetics.com/?utm_source=google&utm_medium=wix_google_business_profile&utm_campaign=1146892448753492994,"88, Unit 17 Clapham Park Rd, Abbeville Mews, London SW4 7BX, Vương quốc Anh",+447946716757,Thẩm mỹ viện,4.9,
Sean White Aesthetics,https://seanwhiteaesthetics.com/,"14, Streatham High Rd, London SW16 1EQ, Vương quốc Anh",+442080504065,Cơ sở chăm sóc da,4.8,
Nessa’s Aesthetics,https://instagram.com/nessas_aesthetics?igshid=YmMyMTA2M2Y=,"90 Atlantic Rd, London SW9 8PX, Vương quốc Anh",+447780583543,Thẩm mỹ viện,5,
Herou aesthetics Lab,https://www.herouaestheticslab.co.uk/,"236B Railton Rd, London SE24 0JT, Vương quốc Anh",+442045399638,Chuyên gia làm đẹp,5,
Belushi Aesthetics,https://www.belushiaesthetics.com/,"12 Streatham High Rd, London SW16 1DB, Vương quốc Anh",+447522673170,"Cơ sở chăm sóc da, Thẩm mỹ viện, Phòng khám, Phòng khám chuyên khoa",5,
Goodbody Clinic - Macsoflondon Medical Aesthetics,https://goodbodyclinic.com/,"Piano House, 9 Brighton Terrace, London SW9 8DJ, Vương quốc Anh",+441225444144,Dịch vụ xét nghiệm máu,,
PERSONAL BEST AESTHETICS LTD,https://www.pbaesthetics.co.uk/,"Personal Best Aesthetics- Quetzal Studio, 125 Dulwich Rd, London SE24 0NG, Reino Unido",+447858315443,Spa terapéutico,5,
London Massage & Spa,https://londonmassageandspa.co.uk/,"Kiosk 10, inside the barber shop, The Arch, Brixton Station Road Brixton Market, 609, London SW9 8JB, United Kingdom",+447557185819,Massage spa,5,
M.A Studio,,"49 Effra Rd, London SW2 1BZ, United Kingdom",+447398901007,"Massage spa, Lymph drainage therapist, Sports massage therapist",5,
Dahab Beauty Lounge,https://www.dahabbeautylounge.co.uk/,"270 Brixton Rd, London SW9 6AQ, United Kingdom",+447963702528,"Beauty salon, Facial spa, Hair removal service, Make-up artist, Massage spa, Massage therapist, Reflexologist, Hairdresser, Waxing hair removal service",4.8,
CasaVille Therapy,,"Unit 22, Brixton Mall, 422 Brixton Rd, London SW9 7AY, United Kingdom",+447878979132,Alternative medicine practitioner,4.8,
Urban Heat Sauna,https://www.urbanheatwellness.com/,"347 Camberwell Station Rd, London SE5 9JN, United Kingdom",+447786969816,"Sauna, Health spa, Public sauna, Spa, Wellness center",5,
Glowing Essence Clinic,https://www.glowingessenceclinic.com/,"352 Lordship Ln, London SE22 8LZ, United Kingdom",+447960878378,"Medical spa, Beauty salon, Cosmetics industry, Dermatologist, Facial spa, Health and beauty shop, Skin care clinic",5,
